{
  "artifact_digest": "aaaaaaaaaaaaaaaaaaaaaaaaaaaaaaaaaaaaaaaaaaaaaaaaaaaaaaaaaaaaaaaa",
  "package_digest": "bbbbbbbbbbbbbbbbbbbbbbbbbbbbbbbbbbbbbbbbbbbbbbbbbbbbbbbbbbbbbbbb",
  "predecessor": null,
  "provenance": {
    "diff_sha256": "cccccccccccccccccccccccccccccccccccccccccccccccccccccccccccccccc",
    "implementation_receipt_sha256": "dddddddddddddddddddddddddddddddddddddddddddddddddddddddddddddddd",
    "source_tree_sha256": "eeeeeeeeeeeeeeeeeeeeeeeeeeeeeeeeeeeeeeeeeeeeeeeeeeeeeeeeeeeeeeee"
  },
  "revision": "example-revision",
  "schema_version": "evidence-tier.v1",
  "tier": "implemented"
}
